Name,Reviews,Date,Ratings
Md Sahidullah,"One of the oldest restaurant of the campus though the owner/contractor has been changed several times. The quality of food is average. In particular, avoid this restaurant for lunch …MoreOne of the oldest restaurant of the campus though the owner/contractor has been changed several times. The quality of food is average. In particular, avoid this restaurant for lunch  as you have chance to eat food from the previous day. This place is good for dinner. Avoid taking thali unless price is an issue. Do not order randomly. Politely ask the waiter for his honest recommendations about the food.  You may have a chance to eat the best food in the campus in lowest price.",2 months ago,"<span class=""_pxg _Jxg"" aria-label=""Rated 4.0 out of 5,""><span style=""width:56px""></span></span>"
Moumita Bhaduri,One of the oldest restraunts in campus.. bt still a great one.. its a great restraunt..they give ample quantity fr the price u pay.. staffs r very well behaved.. nd also taste is great..😊,a week ago,"<span class=""_pxg _Jxg"" aria-label=""Rated 5.0 out of 5,""><span style=""width:70px""></span></span>"
Aakash Chaudhary,Nice food quality and great owner... best place to eat arround... 👍,a month ago,"<span class=""_pxg _Jxg"" aria-label=""Rated 5.0 out of 5,""><span style=""width:70px""></span></span>"
Diyanko Bhowmik,Nice place for food at reasonable price.,a month ago,"<span class=""_pxg _Jxg"" aria-label=""Rated 5.0 out of 5,""><span style=""width:70px""></span></span>"
arunav bhuyan,Not that good restaurant..but its one of the few options available in iit kharagpur campus..the service is average ..not at all clean and the dining halls look really dull and boaring..the quality of food is average and strangly when i …MoreNot that good restaurant..but its one of the few options available in iit kharagpur campus..the service is average ..not at all clean and the dining halls look really dull and boaring..the quality of food is average and strangly when i ordered chicken tanduri they actually served fried chicken pieces coaded with tandoor masala..the chicken curry items are hopeless and all dishes taste same..overall its an average restaurant and one should better eat at home than come here,a month ago,"<span class=""_pxg _Jxg"" aria-label=""Rated 3.0 out of 5,""><span style=""width:42px""></span></span>"
Avinandan Bhakta,Good restaurant for having snacks or main course... Nice environment!!,a month ago,"<span class=""_pxg _Jxg"" aria-label=""Rated 5.0 out of 5,""><span style=""width:70px""></span></span>"
Rakesh Sain,Good restaurant in side IIT campus. Good food quality.,2 months ago,"<span class=""_pxg _Jxg"" aria-label=""Rated 5.0 out of 5,""><span style=""width:70px""></span></span>"
Tharun M,Good food and fast service unless heavily crowded,2 months ago,"<span class=""_pxg _Jxg"" aria-label=""Rated 4.0 out of 5,""><span style=""width:56px""></span></span>"
SABYASACHI MUKHERJEE,Average quality. In veg option mushroom and paneer is good. If anyone looking for thali it will be bad idea.,3 months ago,"<span class=""_pxg _Jxg"" aria-label=""Rated 3.0 out of 5,""><span style=""width:42px""></span></span>"
swapnil agrawal,ok place but need to get better,3 weeks ago,"<span class=""_pxg _Jxg"" aria-label=""Rated 3.0 out of 5,""><span style=""width:42px""></span></span>"
Charandeepsingh Bagga,The chilly fish here is worth trying.,3 months ago,"<span class=""_pxg _Jxg"" aria-label=""Rated 4.0 out of 5,""><span style=""width:56px""></span></span>"
soumyadeep paty,"A wonderful experience! Located inside IIT Kharagpur campus, it is a multi cuisine  restaurant. The staff is well behaved. The food is equally good. The prices are more or less reasonable. All in all it was an amazing experience. Looking forward to visiting it again to try out some of the other dishes.",11 months ago,"<span class=""_pxg _Jxg"" aria-label=""Rated 4.0 out of 5,""><span style=""width:56px""></span></span>"
Sudipto Chakraborty,Good mughlai / Chinese food available.,3 months ago,"<span class=""_pxg _Jxg"" aria-label=""Rated 4.0 out of 5,""><span style=""width:56px""></span></span>"
Rohit Kishan Ray,Not even worth wasting my time on it.,3 months ago,"<span class=""_pxg _Jxg"" aria-label=""Rated 1.0 out of 5,""><span style=""width:14px""></span></span>"
Surajit Ghosh,"Situated at IIT, a decent place to have some foods. Quality of foods are moderately good during lunch time. Not a best place to have dinner.",10 months ago,"<span class=""_pxg _Jxg"" aria-label=""Rated 3.0 out of 5,""><span style=""width:42px""></span></span>"
BUMBA DUTTA,Good service...value for money,4 months ago,"<span class=""_pxg _Jxg"" aria-label=""Rated 4.0 out of 5,""><span style=""width:56px""></span></span>"
Deepak Saxena,"The restaurant is located inside IIT Kharagpur campus. So if you are here in the campus for some work or student you have limited choice for food. Keeping in view that its inside campus and meant to cater to the needs of students. The food …MoreThe restaurant is located inside IIT Kharagpur campus. So if you are here in the campus for some work or student you have limited choice for food. Keeping in view that its inside campus and meant to cater to the needs of students. The food I say is quite average. The taste is just about okay. However the quantity is perhaps on a lesser side keeping in view the cost they charge.Ambience is just okay. They both inside and outside / garden sitting facility. Inside is air-conditioned ( though cooling is questionable).The also got takeaway option. The service is pathetic, you may have to wait for long if you won't order in one go. We have chicken tikka masala and Biryani.",7 months ago,"<span class=""_pxg _Jxg"" aria-label=""Rated 3.0 out of 5,""><span style=""width:42px""></span></span>"
Gulshan Mehta,Very poor state......Served Only Makahan in Dal Makhani... no Dal....White Paneer Butter Masala which is supposed to be Red.Hardly 10% items from the menu available.,7 months ago,"<span class=""_pxg _Jxg"" aria-label=""Rated 1.0 out of 5,""><span style=""width:14px""></span></span>"
Ranjan Chaudhuri,Poor Quality. Avoid if you can,3 months ago,"<span class=""_pxg _Jxg"" aria-label=""Rated 1.0 out of 5,""><span style=""width:14px""></span></span>"
Rajarshi Debnath,Veg items are not good. Foods are ok.,4 months ago,"<span class=""_pxg _Jxg"" aria-label=""Rated 2.0 out of 5,""><span style=""width:28px""></span></span>"
Amitabh Paul,Quaint little place.,a month ago,"<span class=""_pxg _Jxg"" aria-label=""Rated 4.0 out of 5,""><span style=""width:56px""></span></span>"
Sourav Mukhopadhyay,nice place to eat non-veg,5 months ago,"<span class=""_pxg _Jxg"" aria-label=""Rated 4.0 out of 5,""><span style=""width:56px""></span></span>"
Pushpak Roy,Food isn't that good.Better options are available at KGP at much cheaper expense.,11 months ago,"<span class=""_pxg _Jxg"" aria-label=""Rated 3.0 out of 5,""><span style=""width:42px""></span></span>"
Ramchandra Sahoo,The quality and test of the food is very poor. The service also too bad. I want to give (-100) star.,7 months ago,"<span class=""_pxg _Jxg"" aria-label=""Rated 1.0 out of 5,""><span style=""width:14px""></span></span>"
sujata sen,Good place. Reasonable price. Taste is good. :),a year ago,"<span class=""_pxg _Jxg"" aria-label=""Rated 4.0 out of 5,""><span style=""width:56px""></span></span>"
DIPYAMAN SINHA,Inexpensive quality food.,8 months ago,"<span class=""_pxg _Jxg"" aria-label=""Rated 4.0 out of 5,""><span style=""width:56px""></span></span>"
arghyarsree chatterjee,"Hi everyone. Please avoid eating/ ordering from dreamland restaurant. We had ordered a chicken 65 dish along with 3 tandori rotis for takeaway. At dinner time we realised it was not chicken but small pieces of mushroom that were given. We …MoreHi everyone. Please avoid eating/ ordering from dreamland restaurant. We had ordered a chicken 65 dish along with 3 tandori rotis for takeaway. At dinner time we realised it was not chicken but small pieces of mushroom that were given. We first thought parcels might have been exchanged but after bringing up the issue with the owner ( mr sarkar), we realised mushroom 65 is not even on the menue and since we had eaten chicken 65 previously at the same place,  we knew how it tastes or looked like. But shocking of everything was behaviour of the owner...he was uncouth and arrogant. After speaking for sometime with him it was clear that this was not a mistake but deliberately done, probably to save cost...but it is a strategy used by them. Therefore would request all to check and re check orders , particularly takeaways from dreamland. Thanx.",a year ago,"<span class=""_pxg _Jxg"" aria-label=""Rated 1.0 out of 5,""><span style=""width:14px""></span></span>"
Abhishek Maity,Nice place,a month ago,"<span class=""_pxg _Jxg"" aria-label=""Rated 3.0 out of 5,""><span style=""width:42px""></span></span>"
Sunil Shankar,Awesome tastes in all food,5 months ago,"<span class=""_pxg _Jxg"" aria-label=""Rated 5.0 out of 5,""><span style=""width:70px""></span></span>"
Pulkit Jain,"Populated menu,Good food,Nice service,Nice environment",a year ago,"<span class=""_pxg _Jxg"" aria-label=""Rated 4.0 out of 5,""><span style=""width:56px""></span></span>"
ARNAB HALDER,Not good food.,3 months ago,"<span class=""_pxg _Jxg"" aria-label=""Rated 2.0 out of 5,""><span style=""width:28px""></span></span>"
Upasana Biswas,Good food at cheap rates!,a year ago,"<span class=""_pxg _Jxg"" aria-label=""Rated 4.0 out of 5,""><span style=""width:56px""></span></span>"
siva ram,Bit costly food,2 months ago,"<span class=""_pxg _Jxg"" aria-label=""Rated 4.0 out of 5,""><span style=""width:56px""></span></span>"
krishnendu Roy,The food they give is mostly of adequate quality but sometimes they give bad quality food and I have to go to the counter to give order.,a year ago,"<span class=""_pxg _Jxg"" aria-label=""Rated 2.0 out of 5,""><span style=""width:28px""></span></span>"
Ronojit Roy,Prices are a bit high,3 weeks ago,"<span class=""_pxg _Jxg"" aria-label=""Rated 3.0 out of 5,""><span style=""width:42px""></span></span>"
Sumanta Sadhu,Delicious food available,6 months ago,"<span class=""_pxg _Jxg"" aria-label=""Rated 4.0 out of 5,""><span style=""width:56px""></span></span>"
Sourav Sengupta,"Offers good variety of cuisines.It has also an option of Meal(Like Veg Meal,Fish Meal, etc.) during lunch hours.",a year ago,"<span class=""_pxg _Jxg"" aria-label=""Rated 4.0 out of 5,""><span style=""width:56px""></span></span>"
ARINDAM BHATTACHARYA,"Worst food. Ordered chilli chicken twice and the dishes had different colors. No consistency. Once ordered Biriyani and the Biriyani was stale, rice had fermented. Even roadside eateries serve better Biriyani than this restaurant. The Biriyani was some stale rice covered with mutton/chicken curry on top.",a year ago,"<span class=""_pxg _Jxg"" aria-label=""Rated 1.0 out of 5,""><span style=""width:14px""></span></span>"
Laxmi Singh,Food quality is good,a year ago,"<span class=""_pxg _Jxg"" aria-label=""Rated 4.0 out of 5,""><span style=""width:56px""></span></span>"
Rajesh Mondal,Not very reliable,4 months ago,"<span class=""_pxg _Jxg"" aria-label=""Rated 3.0 out of 5,""><span style=""width:42px""></span></span>"
Somesh Ghosh,Good restaurant,4 months ago,"<span class=""_pxg _Jxg"" aria-label=""Rated 5.0 out of 5,""><span style=""width:70px""></span></span>"
Raja Sekhar Battu,tandoori chicken is very bad here they serve half boiled chicken.......ok for other items,a year ago,"<span class=""_pxg _Jxg"" aria-label=""Rated 3.0 out of 5,""><span style=""width:42px""></span></span>"
just toys and more,With good food.,a year ago,"<span class=""_pxg _Jxg"" aria-label=""Rated 5.0 out of 5,""><span style=""width:70px""></span></span>"
Umang Panchal,Excellent food available,11 months ago,"<span class=""_pxg _Jxg"" aria-label=""Rated 5.0 out of 5,""><span style=""width:70px""></span></span>"
Hartej Singh,"Should be avoided unless you have no other choice. Poor service, esp uncurtious staff at counter.If you have been to a fair price shop, you get similar feeling here. You end up …MoreShould be avoided unless you have no other choice. Poor service, esp uncurtious staff at counter.If you have been to a fair price shop, you get similar feeling here. You end up thanking the almighty for finally having been served your order.and ofcourse the staff do feel it a favor on you.Food is ok as per the locale. But, nothing out of the world.See how much time I have to write a longish review as I wait to be served.Better try the time tested Heritage restaurant barely 500m away, than wasting your time here. Unless you like to wait endlessly though.Only saving grace is the taste of food, but, that is quickly marred by the mosquito bites and the smell from the urinal nearby.That is all folks let me enjoy some chat with my friends also. Another way to kill time.",5 years ago,"<span class=""_pxg _Jxg"" aria-label=""Rated 2.0 out of 5,""><span style=""width:28px""></span></span>"
DON _YouTube,Party after xam- quality of food z quite good... Variety of soft drink z nt present....worst service.... …MoreParty after xam- quality of food z quite good... Variety of soft drink z nt present....worst service....Heritage nd Sahara r the better option than dreamland,3 years ago,"<span class=""_pxg _Jxg"" aria-label=""Rated 3.0 out of 5,""><span style=""width:42px""></span></span>"
Dhawal Gadiya,"The last place to go..poor service, bad taste and quality of food..",3 years ago,"<span class=""_pxg _Jxg"" aria-label=""Rated 1.0 out of 5,""><span style=""width:14px""></span></span>"
vignesh shaj,The food is not value for money.,a year ago,"<span class=""_pxg _Jxg"" aria-label=""Rated 3.0 out of 5,""><span style=""width:42px""></span></span>"
Gaurav Biswas,"Nice food, although the place lacks hygiene and staff humility",5 years ago,"<span class=""_pxg _Jxg"" aria-label=""Rated 4.0 out of 5,""><span style=""width:56px""></span></span>"
mause kgp,Service standards can vary,a year ago,"<span class=""_pxg _Jxg"" aria-label=""Rated 3.0 out of 5,""><span style=""width:42px""></span></span>"
Manamrit Pusty,Food some how good.staff behaviour is very very very bad.,a year ago,"<span class=""_pxg _Jxg"" aria-label=""Rated 4.0 out of 5,""><span style=""width:56px""></span></span>"
Diptiparna Sen,Good place,9 months ago,"<span class=""_pxg _Jxg"" aria-label=""Rated 3.0 out of 5,""><span style=""width:42px""></span></span>"
Syed Alia,Dnt evr try 2 vst der.. no rspns.. servc z wrst..,5 years ago,"<span class=""_pxg _Jxg"" aria-label=""Rated 2.0 out of 5,""><span style=""width:28px""></span></span>"
dadu Chandra,Service is not good,a year ago,"<span class=""_pxg _Jxg"" aria-label=""Rated 2.0 out of 5,""><span style=""width:28px""></span></span>"
Aniruddha Balwan,Average restaurant,7 months ago,"<span class=""_pxg _Jxg"" aria-label=""Rated 3.0 out of 5,""><span style=""width:42px""></span></span>"
Shubhrajyoti Sarkar,Nice,a year ago,"<span class=""_pxg _Jxg"" aria-label=""Rated 4.0 out of 5,""><span style=""width:56px""></span></span>"
arbind kumar pandey,Nice,a year ago,"<span class=""_pxg _Jxg"" aria-label=""Rated 4.0 out of 5,""><span style=""width:56px""></span></span>"
Rahul Biswas,Service is average but place lacks hygiene,2 years ago,"<span class=""_pxg _Jxg"" aria-label=""Rated 3.0 out of 5,""><span style=""width:42px""></span></span>"
Laxmi Kant Tiwari,Worst service...don't go in this...,5 years ago,"<span class=""_pxg _Jxg"" aria-label=""Rated 2.0 out of 5,""><span style=""width:28px""></span></span>"
Nandish Jolad,Below average food,a year ago,"<span class=""_pxg _Jxg"" aria-label=""Rated 3.0 out of 5,""><span style=""width:42px""></span></span>"
Tia Sarkar,Food is not tastey,3 years ago,"<span class=""_pxg _Jxg"" aria-label=""Rated 2.0 out of 5,""><span style=""width:28px""></span></span>"
Palash Vijay,Skip a meal instead of coming to this place,4 years ago,"<span class=""_pxg _Jxg"" aria-label=""Rated 1.0 out of 5,""><span style=""width:14px""></span></span>"
Jyoti Ranjan Nayak,Decent,2 years ago,"<span class=""_pxg _Jxg"" aria-label=""Rated 3.0 out of 5,""><span style=""width:42px""></span></span>"
Rajat Verma,Overpriced and overrated..,3 years ago,"<span class=""_pxg _Jxg"" aria-label=""Rated 1.0 out of 5,""><span style=""width:14px""></span></span>"
Amitansu Patra,Not a cheerful service,4 years ago,"<span class=""_pxg _Jxg"" aria-label=""Rated 3.0 out of 5,""><span style=""width:42px""></span></span>"
Mrinal Kumar,worst place,5 years ago,"<span class=""_pxg _Jxg"" aria-label=""Rated 2.0 out of 5,""><span style=""width:28px""></span></span>"
Arunava bera,Dinner,a year ago,"<span class=""_pxg _Jxg"" aria-label=""Rated 5.0 out of 5,""><span style=""width:70px""></span></span>"
Pravat Panda,Suparab,3 months ago,"<span class=""_pxg _Jxg"" aria-label=""Rated 5.0 out of 5,""><span style=""width:70px""></span></span>"
Subhajit Dey,"(Translated by Google) Restaurant, briquette(Original)Resturent, iit",a year ago,"<span class=""_pxg _Jxg"" aria-label=""Rated 5.0 out of 5,""><span style=""width:70px""></span></span>"
S K sahil,(Translated by Google) Beach(Original)Sahil,2 years ago,"<span class=""_pxg _Jxg"" aria-label=""Rated 5.0 out of 5,""><span style=""width:70px""></span></span>"
